{
  "protocol_version": 1,
  "request_id": "req-000001",
  "request_digest": "447def19489b1434a208f7e0dd0c6bb378e185a41e053097bb75735c25631fd8",
  "attempt_id": "attempt-000001",
  "gateway_source_sha": "cccccccccccccccccccccccccccccccccccccccc",
  "command_status": "completed",
  "exit_code": 0,
  "started_at": "2026-09-02T18:00:01Z",
  "finished_at": "2026-09-02T18:00:02Z",
  "duration_ms": 1000,
  "stdout": {
    "sha256": "d117fa006ba9208500b2930ce69cbde436c647afa917cb7396a9bc9111a46dd2",
    "total_bytes": 5,
    "retained_bytes": 5,
    "truncated": false
  },
  "stderr": {
    "sha256": "e3b0c44298fc1c149afbf4c8996fb92427ae41e4649b934ca495991b7852b855",
    "total_bytes": 0,
    "retained_bytes": 0,
    "truncated": false
  },
  "artifacts": {
    "status": "complete",
    "files": [
      {
        "group": "test-results",
        "path": "test-results/example.png",
        "sha256": "ffffffffffffffffffffffffffffffffffffffffffffffffffffffffffffffff",
        "size_bytes": 128
      }
    ],
    "omissions": []
  },
  "finalized_at": "2026-09-02T18:00:03Z",
  "workflow": {
    "repository": "alice/example-control",
    "run_id": 9001,
    "run_attempt": 1,
    "event_name": "issues",
    "event_action": "opened",
    "head_sha": "aaaaaaaaaaaaaaaaaaaaaaaaaaaaaaaaaaaaaaaa"
  }
}
